[{"actor":{"id":"mechanical-design-loop","type":"agent"},"artifacts":[{"path":"validation/result.json","sha256":"69f0295c3b0603b70156a6f6e16d023c119b3fa2e2d08d5a787c29c5512671e9","size_bytes":14248854}],"created_at":"2026-10-11T23:33:13.594216+00:00","data":{"agreement_state":"inconclusive","all_screening_passed":true,"campaign_id":"controller-b54719530a9cb81c","candidate_id":"reference","candidate_ref":{"id":"cube-ab10fca28a864216bcb0.candidate.1","revision":"1"},"controller_digest":"b54719530a9cb81cf9ad12ca62d50afaef81ba1aff0a7145eb35e4636a0a40c7","electrical_energy_j":null,"gpu_state":"completed","half_step_adjudication_performed":false,"input_digest":"e15dbe984ae9230eff7e4a13ae5d990bad1f5f77de9c5dc17a4d2e0ea7dd8f34","numeric_cpu_verified":true,"numeric_gpu_verified":false,"physical_fidelity":null,"physical_verified":false,"score":0.9906999593612426,"screening_pass_fraction":1.0,"selection_scope":"one exploration-selected candidate checked on the frozen independent validation matrix","snapshot_digest":"b7ad0ca76bfc827552638511cf04e6ad7f7d004ddc15a72ed27e17f7680b9cc8","snapshot_ref":{"id":"cube-ab10fca28a864216bcb0.snapshot","revision":"1"},"stage":"validation","state":"completed","temperature_prediction_c":null,"trial_count":12},"id":"cube-ab10fca28a864216bcb0.validation","kind":"simulation_run","links":[{"scope":"inherited trial conditions; new fixed-dt numerical development evidence only","target":{"id":"cube.case.validation","revision":"trace-20261010-2"},"type":"verify"}],"product_node":"cube.system","project_id":"balancing-cube","revision":"1","schema_version":"1.0"}]