[{"actor":{"id":"mechanical-design-loop","type":"agent"},"artifacts":[{"path":"candidates/candidate-002/compiled.json","sha256":"49f2ac8a673716ed94497d482946c48866129163759de851de2a877c3e5179e1","size_bytes":4332}],"created_at":"2026-10-10T10:38:34.729192+00:00","data":{"campaign_id":"controller-b54719530a9cb81c","controller":{"K":[[-8.471773719626915,-9.781444504829218e-10,-1.244420556118551,5.614271130817421e-12,-17.031526704936777,7.09731002933415e-10],[-5.37413797683242e-10,-8.47177372184142,6.734576415079972e-11,-1.2444205561497914,-9.26473389816329e-10,-17.03152670539707]],"closed_loop_eigenvalue_abs":[0.7125025064449718,0.712502506442029,0.8835202823635573,0.8835202824109146,0.921582533582141,0.9215825336013475],"note":"Finite-difference linearization of MuJoCo at equilibrium; fixed SI gains across cases.","state_order":["tilt_x","tilt_y","omega_x","omega_y","wheel_momentum_x","wheel_momentum_y"],"yaw_rate_gain_nm_s":0.03},"input_digest":"c391c566a23c69a6872d19ebe116ef33af5b225798b492b8eb4baf0260cbc49d","mechanical_config":{"actuation":{"continuous_torque_nm":0.008825985,"no_load_speed_rad_s":1267.1090369478834,"note":"対称の線形トルク速度包絡は保守的な仮近似。continuous_torque_nmは比較しきい値で、熱モデルではない。","peak_torque_nm":0.059820565},"contact":{"corner_radius_m":0.004,"rolling_friction_m":0.0,"sliding_friction":0.7,"solimp":[0.95,0.99,0.001],"solref":[0.01,1.0],"torsional_friction_m":0.0},"controller":{"edge_q":[300.0,1.0,50000.0],"edge_r":[100.0],"vertex_q":[300.0,300.0,1.0,1.0,50000.0,50000.0],"vertex_r":[100.0,100.0],"yaw_rate_gain_nm_s":0.03},"evaluation":{"contact_loss_stop_s":0.1,"duration_s":6.0,"loss_of_balance_deg":20.0,"note":"判定値はS1の暫定値。実機の合否条件・最大許容傾斜とは独立。","pivot_drift_stop_mm":30.0,"recovery_band_deg":0.5,"settle_hold_s":1.0,"slip_stop_duration_s":0.15,"slip_stop_speed_m_s":0.05,"video_fps":30,"video_height":720,"video_width":960},"physics":{"control_period_s":0.015,"cube_side_m":0.18,"frame_com_fraction":[0.5,0.5,0.5],"frame_inertia_kg_m2":[0.0024299999999999994,0.0024299999999999994,0.0024299999999999994],"frame_mass_kg":0.44999999999999996,"gravity_m_s2":9.81,"joint_damping_nm_s":0.0,"motor_torque_limit_nm":0.059820565,"timestep_s":0.001,"wheel_axial_inertia_kg_m2":0.000121556,"wheel_face_inset_m":0.012,"wheel_mass_kg":0.07500000000000001,"wheel_radius_m":0.054,"wheel_speed_limit_rad_s":200.0,"wheel_thickness_m":0.006,"wheel_transverse_inertia_kg_m2":6.1428e-05},"reference":{"commit":"fb729c6294c7c45055f66be4568914f3d207608f","confirmed":["3 reaction wheels","ESP32 / MPU6050","15 ms control period","vertex: tilt stabilization and yaw-rate suppression"],"firmware":"esp32_cube_enc","note":"寸法・質量・慣性・モーター特性は未計測。下記は再現可能な仮値。PWMゲインをSIトルクへ転用しない。","url":"https://github.com/remrc/Self-Balancing-Cube"},"revision":"GPU-nominal","sensing":{"control_delay_s":0.015,"gyro_noise_std_deg_s":0.2,"seed":1,"tilt_noise_std_deg":0.05}},"physical_verified":false,"proposal":{"family":"dc_rs385","hypothesis":"Offline wiring test: compare a bounded ring mass change","id":"round-1-offline-fake-1","parameters":{"inner_radius_ratio":0.8,"print_mass_ref_kg":0.12,"side_m":0.18,"wheel_mass_kg":0.05,"wheel_radius_ratio":0.3,"wheel_thickness_m":0.006},"parent_id":"reference"},"snapshot_ref":{"id":"cube-30805114afe0486f9087.snapshot","revision":"1"}},"id":"cube-30805114afe0486f9087.candidate.2","kind":"design_candidate","links":[{"scope":"design intent only; not physical verification","target":{"id":"M-VERTEX","revision":"M-vertex-r1"},"type":"satisfy"}],"product_node":"cube.system","project_id":"balancing-cube","revision":"1","schema_version":"1.0"},{"actor":{"id":"mechanical-design-loop","type":"agent"},"artifacts":[{"path":"candidates/candidate-002/result.json","sha256":"2a7563c60b0d9a858a1a020b783eb2515f0f517f1e490adbfa0a90e6bbada963","size_bytes":12770861}],"created_at":"2026-10-10T10:38:34.737312+00:00","data":{"agreement_state":"inconclusive","all_screening_passed":false,"campaign_id":"controller-b54719530a9cb81c","candidate_id":"round-1-offline-fake-1","candidate_ref":{"id":"cube-30805114afe0486f9087.candidate.2","revision":"1"},"controller_digest":"b54719530a9cb81cf9ad12ca62d50afaef81ba1aff0a7145eb35e4636a0a40c7","electrical_energy_j":null,"gpu_state":"not_run","half_step_adjudication_performed":false,"input_digest":"c391c566a23c69a6872d19ebe116ef33af5b225798b492b8eb4baf0260cbc49d","matrix_cell":"M1C0","numeric_cpu_verified":true,"numeric_gpu_verified":false,"physical_fidelity":null,"physical_verified":false,"proposal":{"family":"dc_rs385","hypothesis":"Offline wiring test: compare a bounded ring mass change","id":"round-1-offline-fake-1","parameters":{"inner_radius_ratio":0.8,"print_mass_ref_kg":0.12,"side_m":0.18,"wheel_mass_kg":0.05,"wheel_radius_ratio":0.3,"wheel_thickness_m":0.006},"parent_id":"reference"},"round":1,"score":-0.30488269667202306,"screening_pass_fraction":0.0,"snapshot_digest":"6f4e565bee98d7495ef396591130bfc0f3ac30e4d7bb8a5f111d526b2feb2bbe","snapshot_ref":{"id":"cube-30805114afe0486f9087.snapshot","revision":"1"},"stage":"exploration","temperature_prediction_c":null,"trial_count":12},"id":"cube-30805114afe0486f9087.evaluation.2","kind":"simulation_run","links":[{"scope":"inherited trial conditions; new fixed-dt numerical development evidence only","target":{"id":"cube.case.exploration","revision":"legacy-20261009"},"type":"verify"}],"product_node":"cube.system","project_id":"balancing-cube","revision":"1","schema_version":"1.0"},{"actor":{"id":"mechanical-design-loop","type":"agent"},"artifacts":[{"path":"round-01/policy-output.json","sha256":"6f102259597abd78c07623eef0f9364cfbba747e790bf86b19365a3168787432","size_bytes":882}],"created_at":"2026-10-10T10:38:34.740463+00:00","data":{"derived_from_candidate":"round-1-offline-fake-1","failure_metrics":["continuous_torque_exceeded_fraction","final_1s_tilt_rms_deg","peak_pivot_displacement_mm","peak_tilt_deg","required_duration_s","speed_governor_fraction","status"],"hypothesis":"Measured candidate round-1-offline-fake-1 score=-0.3048827; prioritize failures ['continuous_torque_exceeded_fraction', 'final_1s_tilt_rms_deg', 'peak_pivot_displacement_mm', 'peak_tilt_deg', 'required_duration_s', 'speed_governor_fraction', 'status'] and compare an allowlisted design change.","parent_revision":1,"permitted_edits":"hypothesis,priority_kdps,search_step only; no executable code or verifier changes","priority_kdps":["D-WHEEL-MASS","I-WHEEL-J","I-WHEEL-JT","D-SPEED-LIMIT","I-COM-X"],"revision":2,"search_step":0.05,"snapshot_ref":{"id":"cube-30805114afe0486f9087.snapshot","revision":"1"}},"id":"cube-30805114afe0486f9087.policy.2","kind":"design_policy","links":[{"target":{"id":"cube-30805114afe0486f9087.policy.1","revision":"1"},"type":"derive"}],"product_node":"cube.system","project_id":"balancing-cube","revision":"1","schema_version":"1.0"}]