[{"actor":{"id":"mechanical-design-loop","type":"agent"},"artifacts":[{"path":"validation/result.json","sha256":"5fc76412b7bc32975797935c939eef73ec6f6b575bbc45a26c900dc3066e240e","size_bytes":14006709},{"path":"round-19/ssot-context.json","sha256":"040845a08f88cc67de98aef168cfc6423717449bd8f6ca0aed07c3a40139a681","size_bytes":1716009},{"path":"round-19/prompt-data.json","sha256":"9ceba6e5fbdb8b7c4ca74bee6f967959192eb33a8f2e0d0b54994342b15d8f7d","size_bytes":128511}],"created_at":"2026-10-12T04:22:33.982661+00:00","data":{"agreement_state":"inconclusive","all_screening_passed":false,"campaign_id":"controller-4c939650fd30d46f","candidate_id":"round-19-round-19-rate-q-scale-1-0560625-momentum-0-85-isolation","candidate_ref":{"id":"cube-5de4f4ef0dbd411c8aa3.candidate.23","revision":"1"},"controller_digest":"4c939650fd30d46f5165a1b953b6281761c603b64daf5a7dd8c592cec27af015","electrical_energy_j":null,"gpu_state":"completed","half_step_adjudication_performed":false,"input_digest":"891bbef60d9d00d3cb5b112fbe17b3d834143b57ab4b6ec7ba0173c6e6a96fdc","numeric_cpu_verified":true,"numeric_gpu_verified":false,"physical_fidelity":null,"physical_verified":false,"score":0.8833405346349856,"screening_pass_fraction":0.9166666666666666,"selection_scope":"one exploration-selected candidate checked on the frozen independent validation matrix","snapshot_digest":"b7ad0ca76bfc827552638511cf04e6ad7f7d004ddc15a72ed27e17f7680b9cc8","snapshot_ref":{"id":"cube-5de4f4ef0dbd411c8aa3.snapshot","revision":"1"},"stage":"validation","state":"completed","temperature_prediction_c":null,"trial_count":12},"id":"cube-5de4f4ef0dbd411c8aa3.validation","kind":"simulation_run","links":[{"scope":"inherited trial conditions; new fixed-dt numerical development evidence only","target":{"id":"cube.case.validation","revision":"trace-20261010-2"},"type":"verify"}],"product_node":"cube.system","project_id":"balancing-cube","revision":"1","schema_version":"1.0"}]