[{"actor":{"id":"mechanical-design-loop","type":"agent"},"artifacts":[{"path":"summary.json","sha256":"11c057aa5ec5e42d90762612247b723afc2bab2775e0300fa72e5a34db15fe31","size_bytes":4379}],"created_at":"2026-10-10T10:18:02.685841+00:00","data":{"best":{"agreement_state":"inconclusive","all_screening_passed":false,"campaign_id":"controller-b54719530a9cb81c","candidate_id":"reference","controller_digest":"b54719530a9cb81cf9ad12ca62d50afaef81ba1aff0a7145eb35e4636a0a40c7","electrical_energy_j":null,"gpu_state":"not_run","half_step_adjudication_performed":false,"input_digest":"9ceeb60b872f79009b7daa2a9d1091676a0eba518f849be438b51fc740b0966f","matrix_cell":"M0C0","numeric_cpu_verified":true,"numeric_gpu_verified":false,"physical_fidelity":null,"physical_verified":false,"proposal":{"family":"reference","hypothesis":"Frozen SSOT reference","id":"reference","parameters":{},"proposer":"environment_owner"},"round":0,"score":-0.019038851408314295,"screening_pass_fraction":0.16666666666666666,"snapshot_digest":"c6d9fa12ed673c66cc5568d57e61b8eaf2c4c946a7d3d412e7c2edb1d5362e22","stage":"exploration","temperature_prediction_c":null,"trial_count":12},"candidates_evaluated":1,"controller_fairness":"fixed_saved_K_per_small_campaign; controller changes create new campaigns; joint changes use 2x2","environment":{"code_digests":{"adapter.py":"7adedfc7bbfbcd502daef2aa8c0d61234c7b104c3a8135d5fe04a93a5ef3a9e0","backend.py":"229e13a09c3c98434bbc239666b8c1cbad1be7e9e6bc4d4a99db64c082cf24a9","contact.py":"6ec557352dfd2660dcae57989b612055c73829fbeebea2ea6a4de50b68c6666d","control.py":"f9a1c69cd66f6f84a18f2c2688d7ccb194d29a008315620ea758c4acd65d84cd","design.py":"263f5408dd0889165fcca370890d7f14fe2b174b2b0d03c93ec387ccb0f02096","evaluation.py":"13992724e07f9b946f7f5a7a43d1c8e74828a5c27793693f02a966acdc250467","gpu_backend.py":"7a983f0412a7452f4f0548d13a30bd0b6a5d0050ab8b917b84ba423ab51c220f","model.py":"562a86013033b3c80072b09ff88544549c379990fcc6752e7668bbf55f034f92"},"holdout_status":"public_integrity_checked","physical_verified":false,"snapshot_digest":"c6d9fa12ed673c66cc5568d57e61b8eaf2c4c946a7d3d412e7c2edb1d5362e22","stage":"EN","timestep_s":0.001},"evolution_scope":"feedback-driven design-search-policy data; no weight training/code/threshold edits","incomplete_evaluations":[],"iterations_completed":0,"iterations_requested":1,"numeric_gpu_verified":false,"onepiece_sync":{"before_summary_record":{"acknowledged":5,"pending":0},"final_status_file":"sync-status.json"},"physical_fidelity":null,"physical_verified":false,"policy":{"failure_metrics":[],"hypothesis":"Compare an allowlisted mechanical/control change against the frozen reference","priority_kdps":[],"revision":1,"search_step":0.1},"rounds":[],"run_id":"cube-a2e5b08f9ee749bc9ba7","scenario":"balancing_cube","selection_status":"provisional","snapshot_ref":{"id":"cube-a2e5b08f9ee749bc9ba7.snapshot","revision":"1"},"status":"completed","stopped_reason":"design_disabled","time_budget_scope":"HTTP timeout capped by remaining time; checked between CPU cases and before/after GPU batches; native solver/JIT calls are not interrupted","validation":{"agreement_state":"inconclusive","all_screening_passed":false,"campaign_id":"controller-b54719530a9cb81c","candidate_id":"reference","candidate_ref":{"id":"cube-a2e5b08f9ee749bc9ba7.candidate.1","revision":"1"},"controller_digest":"b54719530a9cb81cf9ad12ca62d50afaef81ba1aff0a7145eb35e4636a0a40c7","electrical_energy_j":null,"gpu_state":"not_run","half_step_adjudication_performed":false,"input_digest":"9ceeb60b872f79009b7daa2a9d1091676a0eba518f849be438b51fc740b0966f","numeric_cpu_verified":true,"numeric_gpu_verified":false,"physical_fidelity":null,"physical_verified":false,"score":-0.03464574079193625,"screening_pass_fraction":0.16666666666666666,"selection_scope":"one exploration-selected candidate checked on the frozen independent validation matrix","snapshot_digest":"c6d9fa12ed673c66cc5568d57e61b8eaf2c4c946a7d3d412e7c2edb1d5362e22","stage":"validation","state":"completed","temperature_prediction_c":null,"trial_count":12},"wall_time_s":2.9732637499982957},"id":"cube-a2e5b08f9ee749bc9ba7.summary","kind":"analysis_result","links":[],"product_node":"cube.system","project_id":"balancing-cube","revision":"1","schema_version":"1.0"}]