[{"actor":{"id":"mechanical-design-loop","type":"agent"},"artifacts":[{"path":"summary.json","sha256":"559edccfd3bfbb562d1084ed13c91cafcb576fe5b3331f3b2d7315620081e195","size_bytes":6882}],"created_at":"2026-10-10T10:25:45.028103+00:00","data":{"best":{"agreement_state":"inconclusive","all_screening_passed":false,"campaign_id":"controller-b54719530a9cb81c","candidate_id":"reference","controller_digest":"b54719530a9cb81cf9ad12ca62d50afaef81ba1aff0a7145eb35e4636a0a40c7","electrical_energy_j":null,"gpu_state":"not_run","half_step_adjudication_performed":false,"input_digest":"56c04a15de8593a01918b8ed02bcaaf80634a6bc0330122d22a9c06ef9efb9a4","matrix_cell":"M0C0","numeric_cpu_verified":true,"numeric_gpu_verified":false,"physical_fidelity":null,"physical_verified":false,"proposal":{"family":"reference","hypothesis":"Frozen SSOT numerical comparison {'id': 'D-000544-52890', 'revision': 'legacy-20261009'}","id":"reference","parameters":{},"proposer":"environment_owner"},"round":0,"score":0.9072709939032662,"screening_pass_fraction":0.9166666666666666,"snapshot_digest":"6f4e565bee98d7495ef396591130bfc0f3ac30e4d7bb8a5f111d526b2feb2bbe","stage":"exploration","temperature_prediction_c":null,"trial_count":12},"candidates_evaluated":3,"controller_fairness":"fixed_saved_K_per_small_campaign; controller changes create new campaigns; joint changes use 2x2","environment":{"code_digests":{"adapter.py":"7adedfc7bbfbcd502daef2aa8c0d61234c7b104c3a8135d5fe04a93a5ef3a9e0","backend.py":"229e13a09c3c98434bbc239666b8c1cbad1be7e9e6bc4d4a99db64c082cf24a9","contact.py":"6ec557352dfd2660dcae57989b612055c73829fbeebea2ea6a4de50b68c6666d","control.py":"f9a1c69cd66f6f84a18f2c2688d7ccb194d29a008315620ea758c4acd65d84cd","design.py":"76c54344b449f17a58580f2e2ed15b083d71862d302d5fec4222803a4a30d9a9","evaluation.py":"13992724e07f9b946f7f5a7a43d1c8e74828a5c27793693f02a966acdc250467","gpu_backend.py":"7a983f0412a7452f4f0548d13a30bd0b6a5d0050ab8b917b84ba423ab51c220f","model.py":"562a86013033b3c80072b09ff88544549c379990fcc6752e7668bbf55f034f92"},"holdout_status":"public_integrity_checked","physical_verified":false,"snapshot_digest":"6f4e565bee98d7495ef396591130bfc0f3ac30e4d7bb8a5f111d526b2feb2bbe","stage":"EN","timestep_s":0.001},"evolution_scope":"feedback-driven design-search-policy data; no weight training/code/threshold edits","incomplete_evaluations":[],"iterations_completed":2,"iterations_requested":2,"numeric_gpu_verified":false,"onepiece_sync":{"before_summary_record":{"acknowledged":11,"pending":0},"final_status_file":"sync-status.json"},"physical_fidelity":null,"physical_verified":false,"policy":{"derived_from_candidate":"round-2-offline-fake-2","failure_metrics":["continuous_torque_exceeded_fraction","final_1s_tilt_rms_deg","peak_pivot_displacement_mm","peak_tilt_deg","required_duration_s","speed_governor_fraction","status"],"hypothesis":"Measured candidate round-2-offline-fake-2 score=-0.30146413; prioritize failures ['continuous_torque_exceeded_fraction', 'final_1s_tilt_rms_deg', 'peak_pivot_displacement_mm', 'peak_tilt_deg', 'required_duration_s', 'speed_governor_fraction', 'status'] and compare an allowlisted design change.","parent_revision":2,"permitted_edits":"hypothesis,priority_kdps,search_step only; no executable code or verifier changes","priority_kdps":["D-WHEEL-MASS","I-WHEEL-J","I-WHEEL-JT","D-SPEED-LIMIT","I-COM-X"],"revision":3,"search_step":0.025},"rounds":[{"candidate_ids":["round-1-offline-fake-1"],"context_reread":true,"factorial_cells":["M1C0"],"feedback":{"all_screening_passed":false,"candidate_id":"round-1-offline-fake-1","failure_metrics":["continuous_torque_exceeded_fraction","final_1s_tilt_rms_deg","peak_pivot_displacement_mm","peak_tilt_deg","required_duration_s","speed_governor_fraction","status"],"numeric_gpu_verified":false,"physical_verified":false,"score":-0.30488269667202306},"improved":false,"policy_revision_in":1,"policy_revision_out":2,"round":1,"stage_sequence":["EN","PI","R","E"]},{"candidate_ids":["round-2-offline-fake-2"],"context_reread":true,"factorial_cells":["M1C0"],"feedback":{"all_screening_passed":false,"candidate_id":"round-2-offline-fake-2","failure_metrics":["continuous_torque_exceeded_fraction","final_1s_tilt_rms_deg","peak_pivot_displacement_mm","peak_tilt_deg","required_duration_s","speed_governor_fraction","status"],"numeric_gpu_verified":false,"physical_verified":false,"score":-0.3014641295360519},"improved":false,"policy_revision_in":2,"policy_revision_out":3,"round":2,"stage_sequence":["EN","PI","R","E"]}],"run_id":"cube-8d66c7e2f6aa4415b775","scenario":"balancing_cube","selection_status":"provisional","snapshot_ref":{"id":"cube-8d66c7e2f6aa4415b775.snapshot","revision":"1"},"status":"completed","stopped_reason":"round_budget","time_budget_scope":"HTTP timeout capped by remaining time; checked between CPU cases and before/after GPU batches; native solver/JIT calls are not interrupted","validation":{"agreement_state":"inconclusive","all_screening_passed":true,"campaign_id":"controller-b54719530a9cb81c","candidate_id":"reference","candidate_ref":{"id":"cube-8d66c7e2f6aa4415b775.candidate.1","revision":"1"},"controller_digest":"b54719530a9cb81cf9ad12ca62d50afaef81ba1aff0a7145eb35e4636a0a40c7","electrical_energy_j":null,"gpu_state":"not_run","half_step_adjudication_performed":false,"input_digest":"56c04a15de8593a01918b8ed02bcaaf80634a6bc0330122d22a9c06ef9efb9a4","numeric_cpu_verified":true,"numeric_gpu_verified":false,"physical_fidelity":null,"physical_verified":false,"score":0.990699959361392,"screening_pass_fraction":1.0,"selection_scope":"one exploration-selected candidate checked on the frozen independent validation matrix","snapshot_digest":"6f4e565bee98d7495ef396591130bfc0f3ac30e4d7bb8a5f111d526b2feb2bbe","stage":"validation","state":"completed","temperature_prediction_c":null,"trial_count":12},"wall_time_s":12.816498292002507},"id":"cube-8d66c7e2f6aa4415b775.summary","kind":"analysis_result","links":[],"product_node":"cube.system","project_id":"balancing-cube","revision":"1","schema_version":"1.0"}]