[{"actor":{"id":"mechanical-design-loop","type":"agent"},"artifacts":[{"path":"candidates/candidate-001/compiled.json","sha256":"2328342cd3aa260ddd517914758308dbf4edde7ccf6c4f512437c3b5c523f129","size_bytes":4207}],"created_at":"2026-10-11T07:25:35.455104+00:00","data":{"campaign_id":"controller-b54719530a9cb81c","controller":{"K":[[-8.471773719626915,-9.781444504829218e-10,-1.244420556118551,5.614271130817421e-12,-17.031526704936777,7.09731002933415e-10],[-5.37413797683242e-10,-8.47177372184142,6.734576415079972e-11,-1.2444205561497914,-9.26473389816329e-10,-17.03152670539707]],"closed_loop_eigenvalue_abs":[0.7125025064449718,0.712502506442029,0.8835202823635573,0.8835202824109146,0.921582533582141,0.9215825336013475],"note":"Finite-difference linearization of MuJoCo at equilibrium; fixed SI gains across cases.","state_order":["tilt_x","tilt_y","omega_x","omega_y","wheel_momentum_x","wheel_momentum_y"],"yaw_rate_gain_nm_s":0.03},"input_digest":"28c59f388a4937934a90170fb172ecfd787a6611c06f04704e8a21fdac26df6e","mechanical_config":{"actuation":{"continuous_torque_nm":0.0834,"no_load_speed_rad_s":702.6695568529171,"note":"対称の線形トルク速度包絡は保守的な仮近似。continuous_torque_nmは比較しきい値で、熱モデルではない。","peak_torque_nm":0.0834},"contact":{"corner_radius_m":0.004,"rolling_friction_m":0.0,"sliding_friction":0.7,"solimp":[0.95,0.99,0.001],"solref":[0.01,1.0],"torsional_friction_m":0.0},"controller":{"edge_q":[300.0,1.0,50000.0],"edge_r":[100.0],"vertex_q":[300.0,300.0,1.0,1.0,50000.0,50000.0],"vertex_r":[100.0,100.0],"yaw_rate_gain_nm_s":0.03},"evaluation":{"contact_loss_stop_s":0.1,"duration_s":6.0,"loss_of_balance_deg":20.0,"note":"判定値はS1の暫定値。実機の合否条件・最大許容傾斜とは独立。","pivot_drift_stop_mm":30.0,"recovery_band_deg":0.5,"settle_hold_s":1.0,"slip_stop_duration_s":0.15,"slip_stop_speed_m_s":0.05,"video_fps":30,"video_height":720,"video_width":960},"physics":{"control_period_s":0.015,"cube_side_m":0.16623539610269966,"frame_com_fraction":[0.5,0.5,0.5],"frame_inertia_kg_m2":[0.0022588912202982877,0.0022588912202982877,0.0022588912202982877],"frame_mass_kg":0.49045544756507126,"gravity_m_s2":9.81,"joint_damping_nm_s":0.0,"motor_torque_limit_nm":0.0834,"timestep_s":0.001,"wheel_axial_inertia_kg_m2":7.98898172762743e-05,"wheel_face_inset_m":0.012,"wheel_mass_kg":0.07147512673560605,"wheel_radius_m":0.04576646642651467,"wheel_speed_limit_rad_s":200.0,"wheel_thickness_m":0.005654116914454343,"wheel_transverse_inertia_kg_m2":4.029208153110949e-05},"reference":{"commit":"fb729c6294c7c45055f66be4568914f3d207608f","confirmed":["3 reaction wheels","ESP32 / MPU6050","15 ms control period","vertex: tilt stabilization and yaw-rate suppression"],"firmware":"esp32_cube_enc","note":"寸法・質量・慣性・モーター特性は未計測。下記は再現可能な仮値。PWMゲインをSIトルクへ転用しない。","url":"https://github.com/remrc/Self-Balancing-Cube"},"revision":"GPU-nominal","sensing":{"control_delay_s":0.015,"gyro_noise_std_deg_s":0.2,"seed":1,"tilt_noise_std_deg":0.05}},"physical_verified":false,"proposal":{"family":"reference","hypothesis":"Frozen SSOT numerical comparison {'id': 'D-000544-52890', 'revision': 'legacy-20261009'}","id":"reference","parameters":{},"proposer":"environment_owner"},"snapshot_ref":{"id":"cube-2a2594e24d1f4aeea97a.snapshot","revision":"1"}},"id":"cube-2a2594e24d1f4aeea97a.candidate.1","kind":"design_candidate","links":[{"scope":"design intent only; not physical verification","target":{"id":"M-VERTEX","revision":"standards-draft-20261011-2"},"type":"satisfy"}],"product_node":"cube.system","project_id":"balancing-cube","revision":"1","schema_version":"1.0"},{"actor":{"id":"mechanical-design-loop","type":"agent"},"artifacts":[{"path":"candidates/candidate-001/result.json","sha256":"ddc2e04f6c314ff06ed79cc8ebebacf1a1bf00232a5d389471824361c8f59af7","size_bytes":14135838}],"created_at":"2026-10-11T07:25:35.465294+00:00","data":{"agreement_state":"inconclusive","all_screening_passed":false,"campaign_id":"controller-b54719530a9cb81c","candidate_id":"reference","candidate_ref":{"id":"cube-2a2594e24d1f4aeea97a.candidate.1","revision":"1"},"controller_digest":"b54719530a9cb81cf9ad12ca62d50afaef81ba1aff0a7145eb35e4636a0a40c7","electrical_energy_j":null,"gpu_state":"not_run","half_step_adjudication_performed":false,"input_digest":"28c59f388a4937934a90170fb172ecfd787a6611c06f04704e8a21fdac26df6e","matrix_cell":"M0C0","numeric_cpu_verified":true,"numeric_gpu_verified":false,"physical_fidelity":null,"physical_verified":false,"proposal":{"family":"reference","hypothesis":"Frozen SSOT numerical comparison {'id': 'D-000544-52890', 'revision': 'legacy-20261009'}","id":"reference","parameters":{},"proposer":"environment_owner"},"round":0,"score":0.9072709939032662,"screening_pass_fraction":0.9166666666666666,"snapshot_digest":"1af2712315f75427b61585992bfa325aff8d681a343cef462da798d5fc5ad72b","snapshot_ref":{"id":"cube-2a2594e24d1f4aeea97a.snapshot","revision":"1"},"stage":"exploration","temperature_prediction_c":null,"trial_count":12},"id":"cube-2a2594e24d1f4aeea97a.evaluation.1","kind":"simulation_run","links":[{"scope":"inherited trial conditions; new fixed-dt numerical development evidence only","target":{"id":"cube.case.exploration","revision":"trace-20261010-2"},"type":"verify"}],"product_node":"cube.system","project_id":"balancing-cube","revision":"1","schema_version":"1.0"},{"actor":{"id":"mechanical-design-loop","type":"agent"},"artifacts":[{"path":"policy-initial.json","sha256":"2cec171a2360cfa17b7312e5c6ee5abf0d9d7f959d7a171340ada0e3b2974b27","size_bytes":290}],"created_at":"2026-10-11T07:25:33.379158+00:00","data":{"failure_metrics":[],"hypothesis":"Compare an allowlisted mechanical/control change against the frozen reference","priority_kdps":[],"revision":1,"snapshot_ref":{"id":"cube-2a2594e24d1f4aeea97a.snapshot","revision":"1"},"step_enforcement":"advisory_only; compiler enforces absolute mechanical/control bounds","suggested_search_step":0.1},"id":"cube-2a2594e24d1f4aeea97a.policy.1","kind":"design_policy","links":[],"product_node":"cube.system","project_id":"balancing-cube","revision":"1","schema_version":"1.0"}]