[{"actor":{"id":"mechanical-design-loop","type":"agent"},"artifacts":[{"path":"round-02/failed.json","sha256":"19d1aece8cf6163c5b60db81b8f2bd597fad84b2cecad908d5b5fc87fd7c8b33","size_bytes":421},{"path":"round-02/ssot-context.json","sha256":"edf603c7b40903a0b19591e3b29a7f8c0df49219fce3dccbbc00d75e7c2955a4","size_bytes":1630423},{"path":"round-02/prompt-data.json","sha256":"cfdcee6f70970526f2d763cbe79865f056df1c08d4e6a74710a561f59b1569e0","size_bytes":140328}],"created_at":"2026-10-11T23:32:51.466397+00:00","data":{"error":"Full structured prompt (28828 tokens) plus generation budget (4096) exceeds context window (32768); no inference or truncation performed","physical_verified":false,"pi_context_digest":"c40fc59dd22a90224d989f0c603a078e0d7c09a3e29a0e5631c8ea735bae024d","pi_prompt_digest":"3128d937878911ee91be3af55b2147e1aec9a332d336206431947b07a054269c","proposal":null,"round":2,"snapshot_ref":{"id":"cube-ab10fca28a864216bcb0.snapshot","revision":"1"},"status":"failed"},"id":"cube-ab10fca28a864216bcb0.failed.2","kind":"design_proposal","links":[],"product_node":"cube.system","project_id":"balancing-cube","revision":"1","schema_version":"1.0"}]