[{"actor":{"id":"mechanical-design-loop","type":"agent"},"artifacts":[{"path":"summary.json","sha256":"04be009fe75e5137385b7695f907239ee30c99bd0997bcf623ae12a0d6563080","size_bytes":4837}],"created_at":"2026-10-11T07:26:08.501941+00:00","data":{"best":{"agreement_state":"inconclusive","all_screening_passed":false,"campaign_id":"controller-b54719530a9cb81c","candidate_id":"reference","controller_digest":"b54719530a9cb81cf9ad12ca62d50afaef81ba1aff0a7145eb35e4636a0a40c7","electrical_energy_j":null,"gpu_state":"not_run","half_step_adjudication_performed":false,"input_digest":"28c59f388a4937934a90170fb172ecfd787a6611c06f04704e8a21fdac26df6e","matrix_cell":"M0C0","numeric_cpu_verified":true,"numeric_gpu_verified":false,"physical_fidelity":null,"physical_verified":false,"proposal":{"family":"reference","hypothesis":"Frozen SSOT numerical comparison {'id': 'D-000544-52890', 'revision': 'legacy-20261009'}","id":"reference","parameters":{},"proposer":"environment_owner"},"round":0,"score":0.9072709939032662,"screening_pass_fraction":0.9166666666666666,"snapshot_digest":"1af2712315f75427b61585992bfa325aff8d681a343cef462da798d5fc5ad72b","stage":"exploration","temperature_prediction_c":null,"trial_count":12},"candidates_evaluated":1,"controller_fairness":"fixed_saved_K_per_small_campaign; controller changes create new campaigns; joint changes use 2x2","environment":{"code_digests":{"adapter.py":"1ce9774db19e151534540ffb91310f15f4672aa9da7df06c1089b054c212fde1","backend.py":"229e13a09c3c98434bbc239666b8c1cbad1be7e9e6bc4d4a99db64c082cf24a9","contact.py":"3e6d3b10af61be15c55af6bfe46e32f9b82c2fd2abc293400891e89614d52206","control.py":"f9a1c69cd66f6f84a18f2c2688d7ccb194d29a008315620ea758c4acd65d84cd","design.py":"caf9aa46678c0e2aa8bee7b1749924317e2253185bbae4ca64727d2c5b95ec55","evaluation.py":"13992724e07f9b946f7f5a7a43d1c8e74828a5c27793693f02a966acdc250467","gpu_backend.py":"f4e58be3ed145bd6cdadb644796cc26515b7fa6500541f05ea8fd4b842252f7a","model.py":"562a86013033b3c80072b09ff88544549c379990fcc6752e7668bbf55f034f92"},"holdout_status":"public_integrity_checked","physical_verified":false,"snapshot_digest":"1af2712315f75427b61585992bfa325aff8d681a343cef462da798d5fc5ad72b","stage":"EN","timestep_s":0.001},"evolution_scope":"feedback-driven design-search-policy data; no weight training/code/threshold edits","incomplete_evaluations":[],"iterations_completed":2,"iterations_requested":2,"numeric_gpu_verified":false,"onepiece_sync":{"before_summary_record":{"acknowledged":7,"pending":0},"final_status_file":"sync-status.json"},"physical_fidelity":null,"physical_verified":false,"policy":{"failure_metrics":[],"hypothesis":"Compare an allowlisted mechanical/control change against the frozen reference","priority_kdps":[],"revision":1,"step_enforcement":"advisory_only; compiler enforces absolute mechanical/control bounds","suggested_search_step":0.1},"required_gpu":false,"rounds":[{"error":"Only three Q group multipliers and yaw gain may change; R is fixed","round":1,"status":"rejected"},{"error":"Proposal requires id/hypothesis and only allowlisted design fields","round":2,"status":"rejected"}],"run_id":"cube-2a2594e24d1f4aeea97a","scenario":"balancing_cube","selection_status":"provisional","snapshot_ref":{"id":"cube-2a2594e24d1f4aeea97a.snapshot","revision":"1"},"status":"completed","stopped_reason":"round_budget","time_budget_scope":"HTTP timeout capped by remaining time; checked between CPU cases and before/after GPU batches; native solver/JIT calls are not interrupted","validation":{"agreement_state":"inconclusive","all_screening_passed":true,"campaign_id":"controller-b54719530a9cb81c","candidate_id":"reference","candidate_ref":{"id":"cube-2a2594e24d1f4aeea97a.candidate.1","revision":"1"},"controller_digest":"b54719530a9cb81cf9ad12ca62d50afaef81ba1aff0a7145eb35e4636a0a40c7","electrical_energy_j":null,"gpu_state":"not_run","half_step_adjudication_performed":false,"input_digest":"28c59f388a4937934a90170fb172ecfd787a6611c06f04704e8a21fdac26df6e","numeric_cpu_verified":true,"numeric_gpu_verified":false,"physical_fidelity":null,"physical_verified":false,"score":0.990699959361392,"screening_pass_fraction":1.0,"selection_scope":"one exploration-selected candidate checked on the frozen independent validation matrix","snapshot_digest":"1af2712315f75427b61585992bfa325aff8d681a343cef462da798d5fc5ad72b","stage":"validation","state":"completed","temperature_prediction_c":null,"trial_count":12},"wall_time_s":33.633772207998845},"id":"cube-2a2594e24d1f4aeea97a.summary","kind":"analysis_result","links":[],"product_node":"cube.system","project_id":"balancing-cube","revision":"1","schema_version":"1.0"}]