[{"actor":{"id":"mechanical-design-loop","type":"agent"},"artifacts":[{"path":"validation/result.json","sha256":"2b5b7cc0db4b86aa93c32c53d478dc653730695d9b1ead41c5c728417c281638","size_bytes":14134096}],"created_at":"2026-10-11T07:26:07.012233+00:00","data":{"agreement_state":"inconclusive","all_screening_passed":true,"campaign_id":"controller-b54719530a9cb81c","candidate_id":"reference","candidate_ref":{"id":"cube-2a2594e24d1f4aeea97a.candidate.1","revision":"1"},"controller_digest":"b54719530a9cb81cf9ad12ca62d50afaef81ba1aff0a7145eb35e4636a0a40c7","electrical_energy_j":null,"gpu_state":"not_run","half_step_adjudication_performed":false,"input_digest":"28c59f388a4937934a90170fb172ecfd787a6611c06f04704e8a21fdac26df6e","numeric_cpu_verified":true,"numeric_gpu_verified":false,"physical_fidelity":null,"physical_verified":false,"score":0.990699959361392,"screening_pass_fraction":1.0,"selection_scope":"one exploration-selected candidate checked on the frozen independent validation matrix","snapshot_digest":"1af2712315f75427b61585992bfa325aff8d681a343cef462da798d5fc5ad72b","snapshot_ref":{"id":"cube-2a2594e24d1f4aeea97a.snapshot","revision":"1"},"stage":"validation","state":"completed","temperature_prediction_c":null,"trial_count":12},"id":"cube-2a2594e24d1f4aeea97a.validation","kind":"simulation_run","links":[{"scope":"inherited trial conditions; new fixed-dt numerical development evidence only","target":{"id":"cube.case.validation","revision":"trace-20261010-2"},"type":"verify"}],"product_node":"cube.system","project_id":"balancing-cube","revision":"1","schema_version":"1.0"}]