[{"actor":{"id":"mechanical-design-loop","type":"agent"},"artifacts":[{"path":"validation/result.json","sha256":"4d5f432f79b9785416a7642d95b4e1e984e8ea9769a43b615d2a31ac9cc933a9","size_bytes":14251794},{"path":"round-10/ssot-context.json","sha256":"f606f52be73c4105f1007cfce56aa70a098c87734f0f3603057d8a8e8d4ea85f","size_bytes":1661645},{"path":"round-10/prompt-data.json","sha256":"d6b3397283a771b02668256e6cb546000a131e9b644ee233c6a338ab56b6fd08","size_bytes":130332}],"created_at":"2026-10-11T23:56:47.294155+00:00","data":{"agreement_state":"verified","all_screening_passed":false,"campaign_id":"controller-b54719530a9cb81c","candidate_id":"round-10-round-10-round-10-pi-ec45-wheel-radius-speed-margin","candidate_ref":{"id":"cube-f405234bd3834862925d.candidate.13","revision":"1"},"controller_digest":"b54719530a9cb81cf9ad12ca62d50afaef81ba1aff0a7145eb35e4636a0a40c7","electrical_energy_j":null,"gpu_state":"completed","half_step_adjudication_performed":false,"input_digest":"311efa87b6111e26ae9dd28e3cd05efec1a15396d5f9518ea945a9fa960ba237","numeric_cpu_verified":true,"numeric_gpu_verified":true,"physical_fidelity":null,"physical_verified":false,"score":0.9065363695185216,"screening_pass_fraction":0.9166666666666666,"selection_scope":"one exploration-selected candidate checked on the frozen independent validation matrix","snapshot_digest":"b7ad0ca76bfc827552638511cf04e6ad7f7d004ddc15a72ed27e17f7680b9cc8","snapshot_ref":{"id":"cube-f405234bd3834862925d.snapshot","revision":"1"},"stage":"validation","state":"completed","temperature_prediction_c":null,"trial_count":12},"id":"cube-f405234bd3834862925d.validation","kind":"simulation_run","links":[{"scope":"inherited trial conditions; new fixed-dt numerical development evidence only","target":{"id":"cube.case.validation","revision":"trace-20261010-2"},"type":"verify"}],"product_node":"cube.system","project_id":"balancing-cube","revision":"1","schema_version":"1.0"}]