[{"actor":{"id":"mechanical-design-loop","type":"agent"},"artifacts":[{"path":"validation/result.json","sha256":"64fc44c90fcaaec1de7e7df1ec04c471cf7768c1ea302c12c07272209aca0589","size_bytes":14134095}],"created_at":"2026-10-10T10:20:24.055663+00:00","data":{"agreement_state":"inconclusive","all_screening_passed":true,"campaign_id":"controller-b54719530a9cb81c","candidate_id":"reference","candidate_ref":{"id":"cube-40472d441ce84c6b9556.candidate.1","revision":"1"},"controller_digest":"b54719530a9cb81cf9ad12ca62d50afaef81ba1aff0a7145eb35e4636a0a40c7","electrical_energy_j":null,"gpu_state":"not_run","half_step_adjudication_performed":false,"input_digest":"801efa493b458d19174b47d320f397442893f43a8e81604d76e348661e653cd8","numeric_cpu_verified":true,"numeric_gpu_verified":false,"physical_fidelity":null,"physical_verified":false,"score":0.990699959361392,"screening_pass_fraction":1.0,"selection_scope":"one exploration-selected candidate checked on the frozen independent validation matrix","snapshot_digest":"783d9e29443b69fb896f4e3deb538289ac4dbc5f2c210b06c18b2e6f36931259","snapshot_ref":{"id":"cube-40472d441ce84c6b9556.snapshot","revision":"1"},"stage":"validation","state":"completed","temperature_prediction_c":null,"trial_count":12},"id":"cube-40472d441ce84c6b9556.validation","kind":"simulation_run","links":[],"product_node":"cube.system","project_id":"balancing-cube","revision":"1","schema_version":"1.0"}]