[{"actor":{"id":"mechanical-design-loop","type":"agent"},"artifacts":[{"path":"candidates/candidate-001/compiled.json","sha256":"2cd8e3b41a1c72e3572f15005a1c597df8da778fe9dbf1e3caf201475441baf8","size_bytes":4489}],"created_at":"2026-10-17T13:37:14.369741+00:00","data":{"campaign_id":"controller-0464de4575192e6f","controller":{"K":[[-8.014068155428792,-9.184005637354224e-10,-1.1753183648203431,6.033877562539862e-12,-15.70216499837453,6.528415988131513e-10],[-4.92336553359464e-10,-8.014068157489424,6.583004465770395e-11,-1.175318364845879,-8.448019029676158e-10,-15.702164998853354]],"closed_loop_eigenvalue_abs":[0.7348115131665038,0.7348115131621554,0.8810487594501626,0.8810487595001212,0.9232498037826696,0.9232498038007131],"design_parameters":{"momentum_q_scale":0.825,"rate_q_scale":1.0310625,"tilt_q_scale":1.0,"yaw_rate_gain_nm_s":0.03},"fixed_r":[100.0,100.0],"note":"Finite-difference linearization of MuJoCo at equilibrium; fixed SI gains across cases.","state_order":["tilt_x","tilt_y","omega_x","omega_y","wheel_momentum_x","wheel_momentum_y"],"yaw_rate_gain_nm_s":0.03},"input_digest":"151f2bd27d18139b73b5b26f6cdcfff7926c534922e2971bd57ab3b4608483a8","mechanical_config":{"actuation":{"continuous_torque_nm":0.0834,"no_load_speed_rad_s":702.6695568529171,"note":"対称の線形トルク速度包絡は保守的な仮近似。continuous_torque_nmは比較しきい値で、熱モデルではない。","peak_torque_nm":0.0834},"contact":{"corner_radius_m":0.004,"rolling_friction_m":0.0,"sliding_friction":0.7,"solimp":[0.95,0.99,0.001],"solref":[0.01,1.0],"torsional_friction_m":0.0},"controller":{"edge_q":[300.0,1.0,50000.0],"edge_r":[100.0],"vertex_q":[300.0,300.0,1.0,1.0,50000.0,50000.0],"vertex_r":[100.0,100.0],"yaw_rate_gain_nm_s":0.03},"evaluation":{"contact_loss_stop_s":0.1,"duration_s":6.0,"loss_of_balance_deg":20.0,"note":"判定値はS1の暫定値。実機の合否条件・最大許容傾斜とは独立。","pivot_drift_stop_mm":30.0,"recovery_band_deg":0.5,"settle_hold_s":1.0,"slip_stop_duration_s":0.15,"slip_stop_speed_m_s":0.05,"video_fps":30,"video_height":720,"video_width":960},"physics":{"control_period_s":0.015,"cube_side_m":0.16623539610269966,"frame_com_fraction":[0.5,0.5,0.5],"frame_inertia_kg_m2":[0.0022588912202982877,0.0022588912202982877,0.0022588912202982877],"frame_mass_kg":0.49045544756507126,"gravity_m_s2":9.81,"joint_damping_nm_s":0.0,"motor_torque_limit_nm":0.0834,"timestep_s":0.001,"wheel_axial_inertia_kg_m2":7.98898172762743e-05,"wheel_face_inset_m":0.012,"wheel_mass_kg":0.07147512673560605,"wheel_mount_side":"near_corner_000","wheel_radius_m":0.04576646642651467,"wheel_speed_limit_rad_s":200.0,"wheel_thickness_m":0.005654116914454343,"wheel_transverse_inertia_kg_m2":4.029208153110949e-05},"reference":{"commit":"fb729c6294c7c45055f66be4568914f3d207608f","confirmed":["3 reaction wheels","ESP32 / MPU6050","15 ms control period","vertex: tilt stabilization and yaw-rate suppression"],"firmware":"esp32_cube_enc","note":"寸法・質量・慣性・モーター特性は未計測。下記は再現可能な仮値。PWMゲインをSIトルクへ転用しない。","url":"https://github.com/remrc/Self-Balancing-Cube"},"revision":"GPU-nominal","sensing":{"control_delay_s":0.015,"gyro_noise_std_deg_s":0.2,"seed":1,"tilt_noise_std_deg":0.05}},"physical_verified":false,"proposal":{"family":"reference","hypothesis":"Frozen SSOT numerical comparison {'id': 'D-000544-52890.bottom000', 'revision': 'bottom-corner-000-20261017-3'}","id":"reference","parameters":{},"proposer":"environment_owner"},"snapshot_ref":{"id":"cube-04cd1f52e87e4773a9d4.snapshot","revision":"1"}},"id":"cube-04cd1f52e87e4773a9d4.candidate.1","kind":"design_candidate","links":[{"scope":"design intent only; not physical verification","target":{"id":"M-VERTEX","revision":"bottom-corner-000-20261017-3"},"type":"satisfy"}],"product_node":"cube.system","project_id":"balancing-cube","revision":"1","schema_version":"1.0"},{"actor":{"id":"mechanical-design-loop","type":"agent"},"artifacts":[{"path":"candidates/candidate-001/result.json","sha256":"09801e1dbf78c9a4865c6c8a98311cf72c3e48f8b32421207ef64c563c7d6bb2","size_bytes":14112575}],"created_at":"2026-10-17T13:37:14.381052+00:00","data":{"agreement_state":"inconclusive","all_screening_passed":true,"campaign_id":"controller-0464de4575192e6f","candidate_id":"reference","candidate_ref":{"id":"cube-04cd1f52e87e4773a9d4.candidate.1","revision":"1"},"controller_digest":"0464de4575192e6f05686cba326694d93364a3b79176c2b4275b085372e0f92c","electrical_energy_j":null,"gpu_state":"not_run","half_step_adjudication_performed":false,"input_digest":"151f2bd27d18139b73b5b26f6cdcfff7926c534922e2971bd57ab3b4608483a8","matrix_cell":"M0C0","numeric_cpu_verified":true,"numeric_gpu_verified":false,"physical_fidelity":null,"physical_verified":false,"proposal":{"family":"reference","hypothesis":"Frozen SSOT numerical comparison {'id': 'D-000544-52890.bottom000', 'revision': 'bottom-corner-000-20261017-3'}","id":"reference","parameters":{},"proposer":"environment_owner"},"round":0,"score":0.9885861309481805,"screening_pass_fraction":1.0,"snapshot_digest":"4711b819a8e04387d5b9f9a609582ff9930d66f9d7d48d3e0142b6841175b4eb","snapshot_ref":{"id":"cube-04cd1f52e87e4773a9d4.snapshot","revision":"1"},"stage":"exploration","temperature_prediction_c":null,"trial_count":12},"id":"cube-04cd1f52e87e4773a9d4.evaluation.1","kind":"simulation_run","links":[{"scope":"inherited trial conditions; new fixed-dt numerical development evidence only","target":{"id":"cube.case.bottom000.exploration","revision":"bottom-corner-000-20261017-3"},"type":"verify"}],"product_node":"cube.system","project_id":"balancing-cube","revision":"1","schema_version":"1.0"},{"actor":{"id":"mechanical-design-loop","type":"agent"},"artifacts":[{"path":"policy-initial.json","sha256":"2cec171a2360cfa17b7312e5c6ee5abf0d9d7f959d7a171340ada0e3b2974b27","size_bytes":290}],"created_at":"2026-10-17T13:37:12.351659+00:00","data":{"failure_metrics":[],"hypothesis":"Compare an allowlisted mechanical/control change against the frozen reference","priority_kdps":[],"revision":1,"snapshot_ref":{"id":"cube-04cd1f52e87e4773a9d4.snapshot","revision":"1"},"step_enforcement":"advisory_only; compiler enforces absolute mechanical/control bounds","suggested_search_step":0.1},"id":"cube-04cd1f52e87e4773a9d4.policy.1","kind":"design_policy","links":[],"product_node":"cube.system","project_id":"balancing-cube","revision":"1","schema_version":"1.0"},{"actor":{"id":"mechanical-design-loop","type":"agent"},"artifacts":[{"path":"validation/result.json","sha256":"90ecbaed249c9c1b4f7c356c11cae8e4e3d917d41c60c2bf76476992e54f4f6b","size_bytes":14112613}],"created_at":"2026-10-17T13:37:16.149308+00:00","data":{"agreement_state":"inconclusive","all_screening_passed":true,"campaign_id":"controller-0464de4575192e6f","candidate_id":"reference","candidate_ref":{"id":"cube-04cd1f52e87e4773a9d4.candidate.1","revision":"1"},"controller_digest":"0464de4575192e6f05686cba326694d93364a3b79176c2b4275b085372e0f92c","electrical_energy_j":null,"gpu_state":"not_run","half_step_adjudication_performed":false,"input_digest":"151f2bd27d18139b73b5b26f6cdcfff7926c534922e2971bd57ab3b4608483a8","numeric_cpu_verified":true,"numeric_gpu_verified":false,"physical_fidelity":null,"physical_verified":false,"score":0.9885098718332632,"screening_pass_fraction":1.0,"selection_scope":"one exploration-selected candidate checked on the frozen independent validation matrix","snapshot_digest":"4711b819a8e04387d5b9f9a609582ff9930d66f9d7d48d3e0142b6841175b4eb","snapshot_ref":{"id":"cube-04cd1f52e87e4773a9d4.snapshot","revision":"1"},"stage":"validation","state":"completed","temperature_prediction_c":null,"trial_count":12},"id":"cube-04cd1f52e87e4773a9d4.validation","kind":"simulation_run","links":[{"scope":"inherited trial conditions; new fixed-dt numerical development evidence only","target":{"id":"cube.case.bottom000.validation","revision":"bottom-corner-000-20261017-3"},"type":"verify"}],"product_node":"cube.system","project_id":"balancing-cube","revision":"1","schema_version":"1.0"}]