[{"actor":{"id":"mechanical-design-loop","type":"agent"},"artifacts":[{"path":"validation/result.json","sha256":"ce201acc489347c8feab2176c14c9bb62abe046150cdcd50f7abe65976cb9b49","size_bytes":14134095}],"created_at":"2026-10-10T10:25:44.169933+00:00","data":{"agreement_state":"inconclusive","all_screening_passed":true,"campaign_id":"controller-b54719530a9cb81c","candidate_id":"reference","candidate_ref":{"id":"cube-8d66c7e2f6aa4415b775.candidate.1","revision":"1"},"controller_digest":"b54719530a9cb81cf9ad12ca62d50afaef81ba1aff0a7145eb35e4636a0a40c7","electrical_energy_j":null,"gpu_state":"not_run","half_step_adjudication_performed":false,"input_digest":"56c04a15de8593a01918b8ed02bcaaf80634a6bc0330122d22a9c06ef9efb9a4","numeric_cpu_verified":true,"numeric_gpu_verified":false,"physical_fidelity":null,"physical_verified":false,"score":0.990699959361392,"screening_pass_fraction":1.0,"selection_scope":"one exploration-selected candidate checked on the frozen independent validation matrix","snapshot_digest":"6f4e565bee98d7495ef396591130bfc0f3ac30e4d7bb8a5f111d526b2feb2bbe","snapshot_ref":{"id":"cube-8d66c7e2f6aa4415b775.snapshot","revision":"1"},"stage":"validation","state":"completed","temperature_prediction_c":null,"trial_count":12},"id":"cube-8d66c7e2f6aa4415b775.validation","kind":"simulation_run","links":[{"scope":"inherited trial conditions; new fixed-dt numerical development evidence only","target":{"id":"cube.case.validation","revision":"legacy-20261009"},"type":"verify"}],"product_node":"cube.system","project_id":"balancing-cube","revision":"1","schema_version":"1.0"}]