[{"actor":{"id":"mechanical-design-loop","type":"agent"},"artifacts":[{"path":"candidates/candidate-002/compiled.json","sha256":"3c4c368ee10a0dea63e23af7369ca985edd6d119d16e7913924d2c0413d894ca","size_bytes":5430},{"path":"round-01/ssot-context.json","sha256":"60c5f7a05c25e5d91fcd7d4c314d8928dca7f02dfe354c0855fee662f771b4a4","size_bytes":1626673},{"path":"round-01/prompt-data.json","sha256":"c469f77bb986046df0d59d67d558b68265ed92281bbbc059357757f7282f88ac","size_bytes":136829}],"created_at":"2026-10-11T23:32:30.636465+00:00","data":{"campaign_id":"controller-d83a8a80e80aadd3","controller":{"K":[[-9.041477091350083,-1.0504984110500218e-09,-1.330362529249525,5.374116253949491e-12,-18.678081596277927,7.883263316988969e-10],[-5.916821727524598e-10,-9.041477093772135,6.950429425729943e-11,-1.3303625292903465,-1.0207016184241717e-09,-18.678081596786882]],"closed_loop_eigenvalue_abs":[0.6849188905482855,0.6849188905463823,0.8860461369158621,0.8860461368709692,0.9197907513166915,0.9197907513370109],"design_parameters":{"momentum_q_scale":1.25,"rate_q_scale":1.0,"tilt_q_scale":1.0,"yaw_rate_gain_nm_s":0.03},"fixed_r":[100.0,100.0],"note":"Finite-difference linearization of MuJoCo at equilibrium; fixed SI gains across cases.","state_order":["tilt_x","tilt_y","omega_x","omega_y","wheel_momentum_x","wheel_momentum_y"],"yaw_rate_gain_nm_s":0.03},"input_digest":"f5277a97d3e44ea7059893600c0f24626bb6f3541f7ddb79fe4f2885e9d01356","mechanical_config":{"actuation":{"continuous_torque_nm":0.0834,"no_load_speed_rad_s":702.6695568529171,"note":"対称の線形トルク速度包絡は保守的な仮近似。continuous_torque_nmは比較しきい値で、熱モデルではない。","peak_torque_nm":0.0834},"contact":{"corner_radius_m":0.004,"rolling_friction_m":0.0,"sliding_friction":0.7,"solimp":[0.95,0.99,0.001],"solref":[0.01,1.0],"torsional_friction_m":0.0},"controller":{"edge_q":[300.0,1.0,50000.0],"edge_r":[100.0],"vertex_q":[300.0,300.0,1.0,1.0,50000.0,50000.0],"vertex_r":[100.0,100.0],"yaw_rate_gain_nm_s":0.03},"evaluation":{"contact_loss_stop_s":0.1,"duration_s":6.0,"loss_of_balance_deg":20.0,"note":"判定値はS1の暫定値。実機の合否条件・最大許容傾斜とは独立。","pivot_drift_stop_mm":30.0,"recovery_band_deg":0.5,"settle_hold_s":1.0,"slip_stop_duration_s":0.15,"slip_stop_speed_m_s":0.05,"video_fps":30,"video_height":720,"video_width":960},"physics":{"control_period_s":0.015,"cube_side_m":0.16623539610269966,"frame_com_fraction":[0.5,0.5,0.5],"frame_inertia_kg_m2":[0.0022588912202982877,0.0022588912202982877,0.0022588912202982877],"frame_mass_kg":0.49045544756507126,"gravity_m_s2":9.81,"joint_damping_nm_s":0.0,"motor_torque_limit_nm":0.0834,"timestep_s":0.001,"wheel_axial_inertia_kg_m2":7.98898172762743e-05,"wheel_face_inset_m":0.012,"wheel_mass_kg":0.07147512673560605,"wheel_radius_m":0.04576646642651467,"wheel_speed_limit_rad_s":200.0,"wheel_thickness_m":0.005654116914454343,"wheel_transverse_inertia_kg_m2":4.029208153110949e-05},"reference":{"commit":"fb729c6294c7c45055f66be4568914f3d207608f","confirmed":["3 reaction wheels","ESP32 / MPU6050","15 ms control period","vertex: tilt stabilization and yaw-rate suppression"],"firmware":"esp32_cube_enc","note":"寸法・質量・慣性・モーター特性は未計測。下記は再現可能な仮値。PWMゲインをSIトルクへ転用しない。","url":"https://github.com/remrc/Self-Balancing-Cube"},"revision":"GPU-nominal","sensing":{"control_delay_s":0.015,"gyro_noise_std_deg_s":0.2,"seed":1,"tilt_noise_std_deg":0.05}},"physical_verified":false,"pi_context_digest":"6103cd2c612bd1a28d1a7c6cf323063afa1cdf76bd78da501c4c7b29560610f3","pi_prompt_digest":"d4cad709cfebb618034eda314dd8d394e7c7ea09b165c462e2f761ee681e4a44","proposal":{"control":{"momentum_q_scale":1.25,"rate_q_scale":1.0,"tilt_q_scale":1.0,"yaw_rate_gain_nm_s":0.03},"family":"bldc_ec45","hypothesis":"Keep the frozen D-000544-52890 mechanics unchanged and raise only momentum_q_scale from 1.0 to 1.25. The current best fails only speed_governor_fraction, so stronger wheel-momentum regularization should reduce wheel-spin accumulation and the fraction of time the 200 rad/s governor engages. A modest 25% scale preserves the existing tilt/rate behavior enough to avoid regressing peak tilt, final RMS, completion, contact, pivot drift, slip, or torque-threshold exceedance.","id":"round-1-pi-speed-governor-momentum-scale","parameters":{"inner_radius_ratio":0.8590462572822473,"print_mass_ref_kg":0.10848926344219029,"side_m":0.16623539610269966,"wheel_mass_kg":0.03647512673560605,"wheel_radius_ratio":0.27531120025870004,"wheel_thickness_m":0.005654116914454343}},"snapshot_ref":{"id":"cube-ab10fca28a864216bcb0.snapshot","revision":"1"}},"id":"cube-ab10fca28a864216bcb0.candidate.2","kind":"design_candidate","links":[{"scope":"design intent only; not physical verification","target":{"id":"M-VERTEX","revision":"trace-20261010-2"},"type":"satisfy"}],"product_node":"cube.system","project_id":"balancing-cube","revision":"1","schema_version":"1.0"},{"actor":{"id":"mechanical-design-loop","type":"agent"},"artifacts":[{"path":"candidates/candidate-002/result.json","sha256":"a5e79a8c25e6082ea1c7b1298bd34aa0481a20e8991dafffbfe5b2bcbec36b9e","size_bytes":14239298},{"path":"round-01/ssot-context.json","sha256":"60c5f7a05c25e5d91fcd7d4c314d8928dca7f02dfe354c0855fee662f771b4a4","size_bytes":1626673},{"path":"round-01/prompt-data.json","sha256":"c469f77bb986046df0d59d67d558b68265ed92281bbbc059357757f7282f88ac","size_bytes":136829}],"created_at":"2026-10-11T23:32:30.685388+00:00","data":{"agreement_state":"verified","all_screening_passed":false,"campaign_id":"controller-d83a8a80e80aadd3","candidate_id":"round-1-pi-speed-governor-momentum-scale","candidate_ref":{"id":"cube-ab10fca28a864216bcb0.candidate.2","revision":"1"},"controller_digest":"d83a8a80e80aadd30bdcd29f86f003755ca985515c54ad355a110ad64a08d753","electrical_energy_j":null,"gpu_state":"completed","half_step_adjudication_performed":false,"input_digest":"f5277a97d3e44ea7059893600c0f24626bb6f3541f7ddb79fe4f2885e9d01356","matrix_cell":"M0C1","numeric_cpu_verified":true,"numeric_gpu_verified":true,"physical_fidelity":null,"physical_verified":false,"pi_context_digest":"6103cd2c612bd1a28d1a7c6cf323063afa1cdf76bd78da501c4c7b29560610f3","pi_prompt_digest":"d4cad709cfebb618034eda314dd8d394e7c7ea09b165c462e2f761ee681e4a44","proposal":{"control":{"momentum_q_scale":1.25,"rate_q_scale":1.0,"tilt_q_scale":1.0,"yaw_rate_gain_nm_s":0.03},"family":"bldc_ec45","hypothesis":"Keep the frozen D-000544-52890 mechanics unchanged and raise only momentum_q_scale from 1.0 to 1.25. The current best fails only speed_governor_fraction, so stronger wheel-momentum regularization should reduce wheel-spin accumulation and the fraction of time the 200 rad/s governor engages. A modest 25% scale preserves the existing tilt/rate behavior enough to avoid regressing peak tilt, final RMS, completion, contact, pivot drift, slip, or torque-threshold exceedance.","id":"round-1-pi-speed-governor-momentum-scale","parameters":{"inner_radius_ratio":0.8590462572822473,"print_mass_ref_kg":0.10848926344219029,"side_m":0.16623539610269966,"wheel_mass_kg":0.03647512673560605,"wheel_radius_ratio":0.27531120025870004,"wheel_thickness_m":0.005654116914454343}},"round":1,"score":0.9057074590227598,"screening_pass_fraction":0.9166666666666666,"snapshot_digest":"b7ad0ca76bfc827552638511cf04e6ad7f7d004ddc15a72ed27e17f7680b9cc8","snapshot_ref":{"id":"cube-ab10fca28a864216bcb0.snapshot","revision":"1"},"stage":"exploration","temperature_prediction_c":null,"trial_count":12},"id":"cube-ab10fca28a864216bcb0.evaluation.2","kind":"simulation_run","links":[{"scope":"inherited trial conditions; new fixed-dt numerical development evidence only","target":{"id":"cube.case.exploration","revision":"trace-20261010-2"},"type":"verify"}],"product_node":"cube.system","project_id":"balancing-cube","revision":"1","schema_version":"1.0"},{"actor":{"id":"mechanical-design-loop","type":"agent"},"artifacts":[{"path":"round-01/policy-output.json","sha256":"c3a98bd8756cb1ed3576a378e8cc66e54dcb38737d111bfb7d59bb22cb822754","size_bytes":915},{"path":"round-01/ssot-context.json","sha256":"60c5f7a05c25e5d91fcd7d4c314d8928dca7f02dfe354c0855fee662f771b4a4","size_bytes":1626673},{"path":"round-01/prompt-data.json","sha256":"c469f77bb986046df0d59d67d558b68265ed92281bbbc059357757f7282f88ac","size_bytes":136829}],"created_at":"2026-10-11T23:32:30.700845+00:00","data":{"derived_from_candidate":"round-1-pi-speed-governor-momentum-scale","failure_metrics":["speed_governor_fraction"],"hypothesis":"Measured candidate round-1-pi-speed-governor-momentum-scale score=0.90570746; prioritize failures ['speed_governor_fraction'] and compare an allowlisted design change.","parent_revision":1,"permitted_edits":"hypothesis,priority_kdps,suggested_search_step only; no executable code or verifier changes","pi_context_digest":"6103cd2c612bd1a28d1a7c6cf323063afa1cdf76bd78da501c4c7b29560610f3","pi_prompt_digest":"d4cad709cfebb618034eda314dd8d394e7c7ea09b165c462e2f761ee681e4a44","priority_kdps":["D-SPEED-LIMIT","D-WHEEL-MASS","D-WHEEL-RADIUS","I-NOLOAD-SPEED","I-PEAK-TORQUE"],"revision":2,"snapshot_ref":{"id":"cube-ab10fca28a864216bcb0.snapshot","revision":"1"},"step_enforcement":"advisory_only; compiler enforces absolute mechanical/control bounds","suggested_search_step":0.05},"id":"cube-ab10fca28a864216bcb0.policy.2","kind":"design_policy","links":[{"target":{"id":"cube-ab10fca28a864216bcb0.policy.1","revision":"1"},"type":"derive"}],"product_node":"cube.system","project_id":"balancing-cube","revision":"1","schema_version":"1.0"}]