[{"actor":{"id":"mechanical-design-loop","type":"agent"},"artifacts":[{"path":"publication/summary.json","sha256":"c4d5afde24bf5489cc185beb0764cf5751d7621850efbb2ea5dd9fb8df7cc921","size_bytes":4682}],"created_at":"2026-10-17T13:37:17.624564+00:00","data":{"best":{"agreement_state":"inconclusive","all_screening_passed":true,"campaign_id":"controller-0464de4575192e6f","candidate_id":"reference","controller_digest":"0464de4575192e6f05686cba326694d93364a3b79176c2b4275b085372e0f92c","electrical_energy_j":null,"gpu_state":"not_run","half_step_adjudication_performed":false,"input_digest":"151f2bd27d18139b73b5b26f6cdcfff7926c534922e2971bd57ab3b4608483a8","matrix_cell":"M0C0","numeric_cpu_verified":true,"numeric_gpu_verified":false,"physical_fidelity":null,"physical_verified":false,"proposal":{"family":"reference","hypothesis":"Frozen SSOT numerical comparison {'id': 'D-000544-52890.bottom000', 'revision': 'bottom-corner-000-20261017-3'}","id":"reference","parameters":{},"proposer":"environment_owner"},"round":0,"score":0.9885861309481805,"screening_pass_fraction":1.0,"snapshot_digest":"4711b819a8e04387d5b9f9a609582ff9930d66f9d7d48d3e0142b6841175b4eb","stage":"exploration","temperature_prediction_c":null,"trial_count":12},"candidates_evaluated":1,"controller_fairness":"fixed_saved_K_per_small_campaign; controller changes create new campaigns; joint changes use 2x2","environment":{"code_digests":{"adapter.py":"d782ecb1d36879c3aee5e0b6a0e1837aca710b5f04cc38e5fbdf29a4b2651c4c","backend.py":"cc4e1e0fa41870365a322edf425ffb0a259f26f565a4dafc5b0fcf509ed6a18f","contact.py":"3e6d3b10af61be15c55af6bfe46e32f9b82c2fd2abc293400891e89614d52206","control.py":"f9a1c69cd66f6f84a18f2c2688d7ccb194d29a008315620ea758c4acd65d84cd","design.py":"6578d4c763d52d54144ecb7d2d0906c68fed3c1676345459d17d42c9d9a1e973","evaluation.py":"13992724e07f9b946f7f5a7a43d1c8e74828a5c27793693f02a966acdc250467","gpu_backend.py":"f4e58be3ed145bd6cdadb644796cc26515b7fa6500541f05ea8fd4b842252f7a","model.py":"6e7256b93f4b716a2a2b718a42429bf6d5e0cb0196314cc550b19f521c540d3b","multi_gpu.py":"29e66f3aba81d5536fbda80c8c8d1df1cc45755af24294b3961206d0e389aaba"},"holdout_status":"public_integrity_checked","physical_verified":false,"snapshot_digest":"4711b819a8e04387d5b9f9a609582ff9930d66f9d7d48d3e0142b6841175b4eb","stage":"EN","timestep_s":0.001},"evolution_scope":"feedback-driven design-search-policy data; no weight training/code/threshold edits","incomplete_evaluations":[],"iterations_completed":0,"iterations_requested":1,"numeric_gpu_verified":false,"onepiece_sync":{"before_summary_record":{"acknowledged":5,"pending":0},"final_status_file":"sync-status.json"},"physical_fidelity":null,"physical_verified":false,"policy":{"failure_metrics":[],"hypothesis":"Compare an allowlisted mechanical/control change against the frozen reference","priority_kdps":[],"revision":1,"step_enforcement":"advisory_only; compiler enforces absolute mechanical/control bounds","suggested_search_step":0.1},"proposal_rounds_recorded":0,"required_gpu":false,"rounds":[],"run_id":"cube-04cd1f52e87e4773a9d4","scenario":"balancing_cube","selection_status":"provisional","snapshot_ref":{"id":"cube-04cd1f52e87e4773a9d4.snapshot","revision":"1"},"status":"completed","stopped_reason":"design_disabled","time_budget_scope":"HTTP timeout capped by remaining time; checked between CPU cases and before/after GPU batches; native solver/JIT calls are not interrupted","validation":{"agreement_state":"inconclusive","all_screening_passed":true,"campaign_id":"controller-0464de4575192e6f","candidate_id":"reference","candidate_ref":{"id":"cube-04cd1f52e87e4773a9d4.candidate.1","revision":"1"},"controller_digest":"0464de4575192e6f05686cba326694d93364a3b79176c2b4275b085372e0f92c","electrical_energy_j":null,"gpu_state":"not_run","half_step_adjudication_performed":false,"input_digest":"151f2bd27d18139b73b5b26f6cdcfff7926c534922e2971bd57ab3b4608483a8","numeric_cpu_verified":true,"numeric_gpu_verified":false,"physical_fidelity":null,"physical_verified":false,"score":0.9885098718332632,"screening_pass_fraction":1.0,"selection_scope":"one exploration-selected candidate checked on the frozen independent validation matrix","snapshot_digest":"4711b819a8e04387d5b9f9a609582ff9930d66f9d7d48d3e0142b6841175b4eb","stage":"validation","state":"completed","temperature_prediction_c":null,"trial_count":12},"wall_time_s":5.267182875002618},"id":"cube-04cd1f52e87e4773a9d4.summary","kind":"analysis_result","links":[],"product_node":"cube.system","project_id":"balancing-cube","revision":"1","schema_version":"1.0"}]